Project_ID,Project_year,Host_Country,HostInstitute,ZIPcode_Host,Host_city,project_start,Project_end,MainDisciplin,MainDiscNummer
142774,2012,GB,MRC Functional Genetics Unit Department of Physiology Anatomy & Genetics Oxford University,OX1 3QX,Oxford,01.01.2013,30.06.2014,Basic Biology,301
142776,2012,DE,Max-Planck-Institut für Pflanzenzüchtungsforschung,50829,Köln,01.08.2012,31.07.2013,Basic Biology,301
142788,2012,US,Dept. of Cellular and Molecular Physiology School of Medicine Yale University,6520,New Haven,01.09.2012,31.08.2013,Basic Biology,301
142800,2012,DE,Max-Planck-Institut für Entwicklungsbiologie,72076,Tübingen,01.10.2012,31.03.2014,Basic Biology,301
142824,2012,US,Laboratory of Cell Biology The Rockefeller University,10021,New York,01.06.2012,31.05.2013,Basic Biology,301
142886,2012,DE,Max Planck Institute for Chemical Ecology Beutenberg Campus,7745,Jena,01.07.2012,30.06.2013,Basic Biology,301
142890,2012,DE,Adolf Butenandt Institut Lehrstuhl für Molekularbiologie Ludwig-Maximilians-Universität,80336,München,01.01.2013,31.12.2013,Basic Biology,301
142892,2012,US,UCLA,90095-1472,Los Angeles,01.10.2012,30.09.2013,Basic Biology,301
142893,2012,GB,Department of Chemistry University of Cambridge,CB2 1EW,Cambridge,01.09.2012,31.12.2013,Basic Biology,301
142899,2012,GB,MRC Medical Research Council National Institute for Medical Res. Lab. of Developmental Biochemistry,NW7 1AA,London,01.07.2012,31.01.2013,Basic Biology,301
142902,2012,US,Department of Biological Chemistry David Geffen School of Medicine University of California,90095,Los Angeles,01.10.2012,30.09.2013,Basic Biology,301
142911,2012,US,Department of Microbiology Columbia University Medical Center,10032,New York,01.09.2012,31.08.2013,Basic Biology,301
142919,2012,AU,"Evolution, Ecology and Genetics Research School of Biology Australien National University",200,Canberra,01.10.2012,30.09.2013,Basic Biology,301
142925,2012,US,Neural Dynamics and Computation Lab Stanford Neuroscience Institute Stanford University,94305,Stanford,01.09.2012,31.08.2013,Basic Biology,301
142926,2012,CA,Department of Botany University of British Columbia,V6T 1Z4,Vancouver,01.08.2012,31.07.2013,Basic Biology,301
142929,2012,GB,MRC Laboratory for Molecular Cell Biology University College,WC1E 6BT,London,01.01.2013,31.12.2013,Basic Biology,301
143310,2012,US,Radiation Oncology MD Anderson Cancer Center University of Texas,77030-4009,Houston,01.07.2012,31.12.2013,Basic Biology,301
143310,2012,US,"University of California, San Diego Division of Biology",CA92093-0357,La Jolla,01.07.2012,31.12.2013,Basic Biology,301
143529,2012,DK,Natural History Museum of Denmark University of Copenhagen,1350,Copenhagen,01.09.2012,28.02.2014,Basic Biology,301
143643,2012,US,Dept. of Neurosciences University of California San Diego,92093-0634,La Jolla,01.12.2012,31.05.2014,Basic Biology,301
143670,2012,US,Department of Developmental Biology Harvard School of Dental Medicine,2115,Boston ,01.08.2012,31.07.2013,Basic Biology,301
143673,2012,FI,MTT/BI Plant Genomics Lab Institute of Biotechnology University of Helsinki,14,Helsinki,01.10.2012,30.09.2013,Basic Biology,301
144097,2012,US,Laboratory of Prof. Hidde Ploegh Whitehead Institute for Biomedical  Research,2142,"Cambridge, Massachusetts",01.10.2012,31.03.2014,Basic Biology,301
144107,2012,NO,University of Oslo,372,Oslo,01.07.2012,31.12.2013,Basic Biology,301
144148,2012,CA,Institute of Parasitology McGill University,H9X 3V9,St-Anne-de-Bellevue,01.11.2012,31.10.2013,Basic Biology,301
144160,2012,US,Harvard Medical School Massachusetts General Hospital,2129,Charlestown,01.08.2012,31.07.2013,Basic Biology,301
144293,2012,US,University of California UCSF,94143,San Francisco,01.08.2012,31.07.2013,Basic Biology,301
144795,2012,US,Endocrine Division fo the Dept. of Medicine Massachusetts General Hospital Harvard Medical School,2114,Boston,01.10.2012,31.03.2014,Basic Biology,301
145344,2012,CA,Department of Molecular and Cellular Biology College of Biological Science University of Guelph,N1G 2W1,"Guelph, ON",01.01.2013,31.12.2013,Basic Biology,301
145349,2012,US,"University of California Los Angeles UCLA Molecular, Cell & Developmental Biology",90095-7239,Los Angeles,01.10.2013,30.09.2015,Basic Biology,301
145355,2012,SE,Aquatic Ecology Department of Biology Lund University,22362,Lund,01.11.2013,31.10.2015,Basic Biology,301
145358,2012,US,"LCBB, section of Cell Biochemistry NIDDK National Institutes of Health (NIH)",20892,"Bethesda, MD",01.05.2013,30.04.2015,Basic Biology,301
145360,2012,CA,Dept. of Microbiology and Immunology University of British Columbia,V6T 1Z3,Vancouver,01.02.2013,31.07.2014,Basic Biology,301
145366,2012,US,Department of Biomedical Engineering Boston University,2215,Boston,01.03.2013,28.02.2014,Basic Biology,301
145404,2012,DE,Computational Molecular Biology DFG Research Center Matheon Freie Universitaet Berlin,14195,Berlin,01.02.2013,31.01.2015,Basic Biology,301
145407,2012,NL,Centre for Ecological and Evolutionary Studies University of Groningen,9747,AG Groningen,01.04.2013,31.03.2015,Basic Biology,301
145411,2012,NL,Division of Cellular Biochemistry The Netherlands Cancer Institute,1066 CX,Amsterdam,01.02.2013,31.01.2015,Basic Biology,301
145414,2012,US,Stanford Genome Technology Center School of Medicine Stanford University,CA 94304,Palo Alto,01.02.2013,31.08.2014,Basic Biology,301
145543,2012,GB,Babraham Research Institute Babraham,CB2 4AT,Cambridge,01.01.2013,30.09.2013,Basic Biology,301
145558,2012,US,Buck Institute for Age Research,94945,Novato,01.02.2013,31.01.2014,Basic Biology,301
145578,2012,SE,Deptartment of Physiology and Pharmacology Karolinska Institute,171 77,Stockholm,01.12.2012,31.05.2013,Basic Biology,301
145706,2012,AT,Max F. Perutz Laboratories Universität Wien und Medizinische Universität Wien,1030,Wien,01.05.2013,30.04.2014,Basic Biology,301
145710,2012,GB,Department of Chemistry University of Cambridge,CB2 1EW,Cambridge,01.01.2013,31.12.2013,Basic Biology,301
145775,2012,US,Department of Genetics Harvard Medical School Harvard University,2115,Boston,01.02.2013,31.07.2014,Basic Biology,301
145780,2012,US,Broad Institute Harvard and MIT,2142,Cambridge,01.02.2013,31.01.2014,Basic Biology,301
145786,2012,FR,Institut de Génétique Humaine Centre National de Recherche Scientifique,34396,Montpellier cedex 5,01.05.2013,30.04.2014,Basic Biology,301
145791,2012,GB,Weatherall Institute of Molecular Medicine John Radcliffe Hospital University of Oxford,OX3 9DS,Oxford,01.01.2013,31.12.2013,Basic Biology,301
145801,2012,US,Broad Institute Harvard and MIT,2142,Cambridge,01.09.2013,31.08.2014,Basic Biology,301
145803,2012,US,Department of Cellular and Molecular Medicine University of California San Diego,92093,La Jolla,01.03.2013,31.08.2013,Basic Biology,301
145811,2012,US,Neurobiology & Anatomy department University of Utah,84132,Salt Lake City,01.01.2013,31.12.2013,Basic Biology,301
145816,2012,US,The Rockefeller University,10021,New York,01.03.2013,31.08.2014,Basic Biology,301
145830,2012,US,Department of Chemistry Stanford University,94305,"Stanford, CA",01.02.2013,31.07.2013,Basic Biology,301
145835,2012,NL,Centre for Ecological and Evolutionary Studies University of Groningen,9747,AG Groningen,01.01.2014,30.06.2015,Basic Biology,301
145846,2012,GB,Department of Zoology University of Oxford,OX1 3PS,Oxford,01.01.2013,30.06.2013,Basic Biology,301
145846,2012,GB,Research Laboratory for Archaeology University of Oxford,OX1 3QY,Oxford,01.01.2013,30.06.2013,Basic Biology,301
145849,2012,CH,Institute of Molecular Life Sciences Universität Zürich,8057,Zürich,01.02.2013,31.07.2014,Basic Biology,301
145849,2012,DE,Lehrstuhl für Biotechnologie Universität Würzburg Biozentrum,97074,Würzburg,01.02.2013,31.07.2014,Basic Biology,301
145877,2012,AU,European Molecular Biology Laboratory EMBL Australia Monash University,3800,Clayton,01.01.2013,31.12.2013,Basic Biology,301
145878,2012,US,National Institutes of Health,20892,Bethesda,01.02.2013,31.07.2014,Basic Biology,301
145887,2012,FR,Hôpital Necker-Enfants Malades,75730,Paris Cedex 15,01.01.2013,31.08.2013,Basic Biology,301
145940,2012,CA,Samuel Lunenfeld Research Institute Mount Sinai Hospital University of Toronto,M5G 1X5,Toronto,01.01.2013,31.12.2013,Basic Biology,301
145945,2012,US,Department of Chemistry Columbia University,10027,New York,01.06.2013,31.05.2014,Basic Biology,301
145963,2012,US,Nolan Laboratory Baxter Laboratory for Stem Cell Biology Stanford University,94305,Stanford,01.01.2013,31.12.2013,Basic Biology,301
145968,2012,US,"Resource for Biocomputing, Visualization and Informatics University of California, San Francisco",94158-2517,San Francisco,01.05.2013,30.04.2014,Basic Biology,301
145987,2012,GB,Dept of Chemical Engineering & Biotechnology University of Cambridge,CB2 3RA,Cambridge,01.01.2013,30.06.2013,Basic Biology,301
145994,2012,US,Laboratory of Genetics The Salk Institute for Biological Studies,92186-5800,San Diego,01.04.2013,31.03.2014,Basic Biology,301
145995,2012,GB,The Babraham Institute,CB22 3AT,Cambridge,01.02.2013,31.01.2014,Basic Biology,301
145998,2012,US,Department of Cell Biology Harvard Medical School,2115,Boston,01.07.2013,30.06.2014,Basic Biology,301
146207,2012,US,University of Miami School of Medicine,33136,Miami,01.04.2013,31.03.2014,Basic Biology,301
146277,2012,US,Department of Biochemistry University of Toronto,M5S 1A8,Toronto,01.05.2013,30.04.2015,Basic Biology,301
146554,2012,GB,University of Cambridge Dept. of Electrical Engineering,CB2 1PZ,Cambridge,01.02.2013,31.07.2014,Basic Biology,301
146571,2012,ES,Grup de Recerca en Informatica Biomedica Centre de Regulacio Genomica (CRG) IMIM y UPF,8003,Barcelona,01.03.2013,31.08.2014,Basic Biology,301
146571,2012,GB,Institute for Stem Cell Research School of Biological Sciences University of Edinburgh,EH9 3JQ,Edinburgh,01.03.2013,31.08.2014,Basic Biology,301
146778,2012,IL,Weizmann Institute of Science Dept. of Cell Biology,76100,Rehovot,01.03.2013,31.12.2013,Basic Biology,301
146958,2012,DE,Developmental Biology Unit European Molecular Biology Laboratory EMBL,69117,Heidelberg,01.02.2013,30.06.2013,Basic Biology,301
146961,2012,IL,Weizman Institute of Science,76100,Rehovot,01.04.2013,31.08.2013,Basic Biology,301
147194,2012,DE,Cell Biology and Cell Biophysics Programme European Molecular Biology Laboratory,69117,Heidelberg,01.04.2013,31.03.2014,Basic Biology,301
147242,2012,ES,Grup de Recerca en Informatica Biomedica Centre de Regulacio Genomica (CRG) IMIM y UPF,8003,Barcelona,01.04.2013,31.03.2014,Basic Biology,301
147291,2012,US,Department of Biochemistry University of Utah,84112-5650,Salt Lake City,01.02.2013,31.01.2014,Basic Biology,301
147302,2012,US,Center for Cancer Research National Cancer Institute National Institutes of Health,20892,Bethesda,01.04.2013,28.02.2014,Basic Biology,301
147867,2013,GB,Breakthrough Breast Cancer Research Centre at the Institute of Cancer Research Chester Beatty Laboratories,SW3 6JB,London,01.07.2013,30.06.2015,Basic Biology,301
147872,2013,US,Dept. of Stem Cell and Regenerative Biology Harvard University,MA 02138,Cambridge,01.09.2013,31.08.2015,Basic Biology,301
147876,2013,US,Department of Systems Biology Harvard Medical School,2138,Boston,01.08.2013,31.01.2015,Basic Biology,301
147887,2013,US,Hellen Diller Comprehensive Cancer Center University of California at San Francisco,94158,San Francisco,01.08.2013,31.07.2015,Basic Biology,301
147894,2013,FI,Institute of Biotechnology University of Helsinki,14,Helsinki,01.09.2013,28.02.2015,Basic Biology,301
147895,2013,ES,Cell Signaling Research group (Posas) Department of Experimental and Health Scienc Universitat Pompeu Fabra,8003,Barcelona,01.08.2013,31.07.2015,Basic Biology,301
147896,2013,US,Laboratory of Mammalian Cell Biology and Development The Rockefeller University,10021,New York,01.08.2013,31.07.2015,Basic Biology,301
147897,2013,AT,Forschungszentrum für Molekulare Medizin der Österr. Akademie der Wissenschaften,1090,Wien,01.08.2013,31.07.2015,Basic Biology,301
147899,2013,PL,International Instiute for Molecular and Cell Biology laboratory of Dr. Chacinska,02-109,Warsaw,01.08.2013,31.01.2015,Basic Biology,301
147901,2013,US,The Baker Laboratory Molecular Engineering & Sciences University of Washington,WA 98195,Seattle,01.11.2013,31.10.2015,Basic Biology,301
147902,2013,US,Department of Molecular and Cellular Biology Harvard University,2138,Cambridge,01.08.2013,31.01.2015,Basic Biology,301
147904,2013,GB,European Bioinformatics Institute EMBL Outstation - Hinxton,CB10 1SD,"Hinxton, Cambridge",01.09.2013,31.08.2014,Basic Biology,301
147905,2013,US,Harvard Inst. of Chemistry & Cell Biology Harvard University,2138,Cambridge,01.07.2013,30.06.2014,Basic Biology,301
148361,2013,US,Prof. Daniel A. Haber laboratory Massachusetts General Hospital Cancer Center Harvard Medical School,2129,Boston,01.09.2013,31.08.2015,Basic Biology,301
148404,2013,US,Department of Neurology Baylor College of Medicine,77030,Houston,01.01.2014,31.12.2014,Basic Biology,301
148442,2013,US,Department of Microbiology and Immunobiology Harvard Medical School,2115,"Boston, MA",01.08.2013,31.01.2015,Basic Biology,301
148445,2013,US,Department of Biostatistics School of Public Health University of Washington,98195,"Seattle, WA",01.10.2013,31.03.2015,Basic Biology,301
148445,2013,US,National Institute of Standards and Technology U.S. Department of Commerce,20899-8401,Gaithersburg,01.10.2013,31.03.2015,Basic Biology,301
148446,2013,ES,Centre for Genomic Regulation (CRG),8003,Barcelona,01.09.2013,28.02.2015,Basic Biology,301
148450,2013,GB,Section of Cell and Molecular Biology Faculty of Medicine Imperial College of Science,SW7 2AZ,"London, South Kensington",01.09.2013,28.02.2015,Basic Biology,301
148452,2013,DE,Abteilung Mikrobiologie Institut für Biologie II Albert-Ludwigs-Universität,79104,Freiburg im Breisgau,01.07.2013,30.06.2014,Basic Biology,301
148452,2013,FR,Lab.de Chimie et d'Electronique et de Photonique Moléculaires Université Louis Pasteur Strasbourg,67008,Strasbourg Cedex,01.07.2013,30.06.2014,Basic Biology,301
148455,2013,GB,Wolfson Centre for Age-Related Diseases King's College London,SE1 1UL,London,01.08.2013,31.01.2015,Basic Biology,301
148484,2013,US,Lewis-Sigler Institute for Integrative Genom Department of Lewis-Sigler Princeton University,8544,Princeton,01.05.2014,31.10.2015,Basic Biology,301
148494,2013,US,Koch Institute Integrative Cancer Research Massachusetts Institute of Technology (MIT),MA 02139,"Cambridge, MA",01.06.2014,30.11.2015,Basic Biology,301
148531,2013,US,"Department of Biochemistry and Biophysics University of California, San Francisco",94158-2517,San Francisco,01.04.2014,30.09.2015,Basic Biology,301
148576,2013,GB,Center for Plant Sciences Faculty of Biological Sciences University of Leeds,LS2 9JT,Leeds,01.10.2013,31.10.2013,Basic Biology,301
148579,2013,SG,Temasek Life Sciences Laboratory Limited National University of Singapore,117604,Singapore,01.09.2013,28.02.2015,Basic Biology,301
148600,2013,US,Department of Genetics Yale University School of Medicine,06520-8005,New Haven,01.07.2013,31.12.2014,Basic Biology,301
148629,2013,DE,Evolutionsbiologie Fachbereich Biologie Universität Konstanz,78457,Konstanz,01.08.2013,31.01.2015,Basic Biology,301
148637,2013,US,Whitehead Institute for Biomedical Research Massachusetts Institute of Technology,02142-1479,Cambridge,01.08.2013,31.01.2015,Basic Biology,301
148649,2013,US,"Department of Physics University of California, San Diego",92093-0319,La Jolla,01.09.2014,31.08.2015,Basic Biology,301
148663,2013,US,Department of Molecular Biology Princeton University,08544-1014,Princeton,01.07.2013,31.12.2014,Basic Biology,301
148683,2013,US,The Wistar Institute,19104,Philadelphia,01.10.2013,31.03.2014,Basic Biology,301
148742,2013,US,University of California Cellular and Molecular Pharmacology,94143,San Francisco,01.06.2013,31.05.2014,Basic Biology,301
148748,2013,DE,Max-Planck-Institut für Infektionsbiologie,10117,Berlin,01.09.2013,31.08.2014,Basic Biology,301
148775,2013,US,"Harvard University Biolabs, Room 4033",2138,Cambridge,01.09.2013,28.02.2015,Basic Biology,301
148794,2013,US,Whitehead Institute for Biomedical Research Massachusetts Institute of Technology,02142-1479,Cambridge,01.08.2013,31.07.2014,Basic Biology,301
148800,2013,FR,Evolution du Plancton et PaleOceans CNRS & Université Paris Station Biologique de Roscoff - SBR,29680,Roscoff,01.12.2013,31.05.2015,Basic Biology,301
148812,2013,US,Ernest Orlando Lawrence Berkeley National Lab.,94720,Berkeley,01.06.2013,31.03.2014,Basic Biology,301
148852,2013,US,"Department of Biochemistry and Biophysics University of California, San Francisco",94158-2324,San Francisco,01.09.2013,28.02.2015,Basic Biology,301
148860,2013,US,Department of Biological Chemistry and Molecular Pharmacology Harvard Medical School,2115,Boston,01.06.2013,30.11.2014,Basic Biology,301
148914,2013,US,Dept. of Pharmaceutical Chemistry University of California,94158 2330,San Francisco,01.10.2013,31.03.2015,Basic Biology,301
151129,2013,DE,Adolf Butenandt Institut Lehrstuhl für Molekularbiologie Ludwig-Maximilians-Universität,80336,München,01.02.2014,31.01.2016,Basic Biology,301
151137,2013,NO,Centre for Molecular Biology and Neuroscience University of Oslo,317,Oslo,01.02.2014,31.07.2015,Basic Biology,301
151146,2013,US,Dept. of Immunology & Infectious Diseases Harvard School of Public Health,2115,Boston ,01.02.2014,31.07.2015,Basic Biology,301
151154,2013,US,Dept. of Cellular and Molecular Pharmacology Dept. of Cellular and Molecular Pharmacology,94158,"San Francisco, CA",01.06.2015,30.11.2016,Basic Biology,301
151157,2013,SE,"Dept of Microbiology, Tumor and Cell Biology Karolinska Intsitutet",17177,Stockholm,01.02.2014,31.01.2016,Basic Biology,301
151171,2013,US,Laboratory of Molecular Neuro-Oncology  Rockefeller University,10065,New York,01.04.2014,30.09.2015,Basic Biology,301
151179,2013,US,Massachusetts Institute of Technology Dept. of Chemical Engineering,2139,Cambridge,01.03.2014,29.02.2016,Basic Biology,301
151194,2013,US,Harvard Medical School Dept. of Cell Biology,2115,Boston,01.02.2014,31.01.2015,Basic Biology,301
151580,2013,DE,Dept. Proteomics and Signal Transduction Max Planck Institute of Biochemistry,82152,Martinsried (near Munich),01.01.2014,30.06.2015,Basic Biology,301
151582,2013,US,Dept. of Molecular and Cellular Biology Harvard University,2138,Cambridge,01.02.2014,31.07.2015,Basic Biology,301
151589,2013,FR,Institut Curie UMR 144 Section de recherche,75005,Paris Cedex,01.08.2014,31.01.2016,Basic Biology,301
151591,2013,JP,Lab of Molecular and Cellular Neuroscience Dept. Developmental Biology and Neuroscience Tohoku University,980-8577,Sendai,01.02.2014,31.07.2015,Basic Biology,301
151594,2013,AU,School of Biological Sciences University of Sydney,2006,Sydney,01.04.2014,30.09.2015,Basic Biology,301
151598,2013,US,Department of Biology Stanford University,94305,Stanford,01.05.2014,31.10.2015,Basic Biology,301
151609,2013,US,Department of Genetics and Complex Diseases Harvard School of Public Health,2115,Boston,01.02.2014,31.07.2015,Basic Biology,301
151617,2013,US,Research Laboratory of Electronics Massachusetts Institute of Technology,02139-4307,Cambridge,01.07.2014,31.12.2015,Basic Biology,301
151663,2013,CA,Department of Chemistry University of Montreal,H3C 3FC,Montréal,01.04.2014,30.09.2015,Basic Biology,301
151739,2013,US,Division of Nephrology Department of Medicine Harvard Medical School,2129,Charlestown,01.03.2014,29.02.2016,Basic Biology,301
151757,2013,CA,Department of Psychiatry Douglas McGill University,H3A 1A1,Montréal,01.08.2014,31.01.2016,Basic Biology,301
151759,2013,GB,MRC Laboratory of Molecular Biology,CB2 0QH,Cambridge,01.04.2014,30.09.2015,Basic Biology,301
151770,2013,US,Department of Biology &  South Texas Center for Emerging Infectious Diseases The University of Texas at San Antonio,78249,San Antonio,01.04.2014,30.09.2015,Basic Biology,301
151780,2013,US,Dept. of Plant Pathology University of California,92521,Riverside,01.12.2013,31.05.2015,Basic Biology,301
151811,2013,US,Department of Cell Biology The Scripps Research Institute,92037,La Jolla,01.04.2014,30.09.2015,Basic Biology,301
151825,2013,US,Departments of Pediatrics and Genetics Stanford University School of Medicine,94305-5208,Stanford,01.03.2014,31.08.2015,Basic Biology,301
151831,2013,US,University of California Department of Medecine Diabetes Center,94143-0540,San Francisco,01.01.2014,30.06.2015,Basic Biology,301
151859,2013,US,Department of Immunology & Infectious Diseases Harvard School of Public Health,2115,Boston,01.02.2014,31.07.2015,Basic Biology,301
151863,2013,US,Department of Chemistry and Chemical  Engineering California Institute of Technology,91125,Pasadena,01.03.2014,31.08.2015,Basic Biology,301
151880,2013,AU,Division of Infection and Immunity The Walter and Eliza Hall Institute of Medical Research,3050,Parkville,01.01.2014,30.06.2015,Basic Biology,301
151885,2013,US,Picower Institute for Learning and Memory Massachusetts Institute of Technology MIT,02139-4307,Cambridge,01.05.2014,31.10.2015,Basic Biology,301
151886,2013,US,Genomics Division Lawrence Berkeley National Laboratory,94720,Berkeley,01.08.2014,31.01.2016,Basic Biology,301
151932,2013,KE,Internat. Centre of Insect Physiology and Ecology ICIPE,30772,Nairobi,01.04.2014,30.09.2015,Basic Biology,301
151952,2013,US,Rockefeller University,10021,New York,01.02.2014,31.07.2015,Basic Biology,301
151954,2013,US,The Salk Institute for Biological Studies Systems Neurobiology Laboratories,92037,La Jolla,01.04.2014,30.09.2015,Basic Biology,301
151960,2013,DE,Max-Planck-Institut für Molekulare Genetik,14195,Berlin,01.02.2014,31.07.2015,Basic Biology,301
151962,2013,GB,MRC Laboratory of Molecular Biology,CB2 0QH,Cambridge,01.01.2014,30.06.2015,Basic Biology,301
151966,2013,CA,Keenan Research Centre Li Ka Shing Knowledge Institute St. Michael's Hospital,M5B 1X8,Toronto,01.07.2014,31.12.2015,Basic Biology,301
151974,2013,US,Department of Genetics Harvard Medical School Harvard University,2115,Boston,01.04.2014,30.09.2015,Basic Biology,301
151978,2013,US,"Northwestern University Dept. of Biochemistry, Molecular Biology and Cell Biology",60208-3500,Evanston,01.02.2014,31.07.2015,Basic Biology,301
152091,2013,GB,Department of Materials Imperial College London,SW7 2AZ,London,01.04.2014,30.09.2015,Basic Biology,301
152098,2013,US,Division of General Pediatrics Department of Medicine Children's Hospital Boston,2115,Boston,01.06.2014,30.11.2015,Basic Biology,301
152131,2013,US,The Skaggs Institute for Chemical Biology The Scripps Research Institute,92037,La Jolla,01.02.2014,31.07.2015,Basic Biology,301
152138,2013,NL,Hubrecht Laboratory Netherlands Institute for Developmental Biology,3584 CT,Utrecht,01.01.2014,30.06.2015,Basic Biology,301
152143,2013,AU,The Garvan Institute of Medical Research,2010,"Darlinghurst, Sydney",01.01.2014,30.06.2015,Basic Biology,301
152159,2013,FR,Unité de pathogénie moléculaire microbienne INSERM U786 Institut Pasteur,75015,Paris,01.01.2014,30.06.2015,Basic Biology,301
152173,2013,US,Mission Bay Genentech Hall University of California,94143-2140,San Francisco,01.03.2014,31.08.2015,Basic Biology,301
152212,2013,US,Department of Biology Massachusetts Institute of Technology,2139,Cambridge,01.01.2014,30.06.2015,Basic Biology,301
152241,2013,GB,Department of Zoology University of Oxford,OX1 3PS,Oxford,01.06.2014,30.11.2015,Basic Biology,301
152243,2013,DE,Institut für Pflanzengenetik und Kulturpflanzenforschung,6466,Gatersleben,01.04.2014,30.09.2015,Basic Biology,301
154613,2014,US,"Department of Evolution and Ecology College of Biological Sciences University of California, Davis",95616,Davis,01.09.2014,31.08.2016,Basic Biology,301
154613,2014,AT,Institute of Mathematics University of Vienna,1090,Vienna,01.09.2014,31.08.2016,Basic Biology,301
154614,2014,DE,Adult Neurogenesis & Cellular Reprogramming Institute of Physiological Chemistry Johannes Gutenberg University Mainz,55128,Mainz,01.10.2014,30.09.2016,Basic Biology,301
154624,2014,US,Dept. of Molecular and Cell Biology University Of California Berkeley,94720-3202,Berkeley,01.08.2014,31.07.2016,Basic Biology,301
154627,2014,US,Department of Genetics Harvard Medical School Brigham and Women's Hospital,2115,Boston,01.08.2014,31.07.2016,Basic Biology,301
154627,2014,CH,Institut de Microbiologie Université de Lausanne,1011,Lausanne,01.08.2014,31.07.2016,Basic Biology,301
154631,2014,US,Department of Cell and Developmental Biolog University of Michigan,MI 48109,Ann Arbor,01.08.2014,31.01.2016,Basic Biology,301
154632,2014,US,Buck Institute for Age Research,94945,Novato,01.08.2014,31.07.2016,Basic Biology,301
154633,2014,US,Islet Cell Biology & Regenerative Biology Joslin Diabetes Center Harvard Medical School,2115,Boston,01.08.2014,31.01.2016,Basic Biology,301
154636,2014,GB,Computational and Biological Learning Lab Department of Engineering University of Cambridge,CB2 1PZ,Cambridge,01.08.2014,31.01.2016,Basic Biology,301
154646,2014,CA,Dept. of Biochemistry and Molecular Biology University of British Columbia,V6T 1Z3,Vancouver,01.08.2014,31.07.2016,Basic Biology,301
154647,2014,US,Columbia University Biological Sciences,10027,New York,01.08.2014,31.01.2016,Basic Biology,301
154655,2014,GB,Metabolic Research Laboratories Institute of Metabolic Science University of Cambridge,CB2 0QQ,Cambridge,01.09.2014,29.02.2016,Basic Biology,301
154657,2014,US,Whitehead Institute for Biomedical Research Massachusetts Institute of Technology,02142-1479,Cambridge,01.08.2014,31.07.2016,Basic Biology,301
154664,2014,AU,Centre for Micro Photonics Swinburne University of Technology,,Melbourne,01.10.2014,30.09.2015,Basic Biology,301
154667,2014,US,Developmental Biology Memorial Sloan-Kettering Cancer Center,10065,New York,01.08.2014,31.07.2015,Basic Biology,301
155042,2014,DE,Institut für Chemie TU Berlin,10623,Berlin,01.09.2014,29.02.2016,Basic Biology,301
